key,family,family_display,category,subcategory,story_group,chapter_code,chapter_label,conversation_key,conversation_label,scene_key,scene_label,scene_group,scene_part_a,scene_part_b,line_index,dialogue_type,speaker_name,speaker_role,speaker_display,speaker_key,speaker_bucket,speaker_slot,speaker_confidence,mentions,text_raw,text_clean,source_path
contents_wanted_her_0010_npc_00_00009,contents,Contents,Scene Dialogue,Contents,Contents,0010,Contents 0010,contents_wanted_her_0010,wanted_her_0010,contents_wanted_her_0010_npc_00,wanted_her_0010_npc_00,wanted_her_0010,wanted,her_0010,9,npc_00,,npc_00,NPC 00,NPC 00,NPC,0,role,,Sneaky vermin...,Sneaky vermin...,gamedata/localizationstring_eng.paloc
contents_wanted_her_0010_npc_00_00010,contents,Contents,Scene Dialogue,Contents,Contents,0010,Contents 0010,contents_wanted_her_0010,wanted_her_0010,contents_wanted_her_0010_npc_00,wanted_her_0010_npc_00,wanted_her_0010,wanted,her_0010,10,npc_00,,npc_00,NPC 00,NPC 00,NPC,0,role,,I'm running out of places to put up the bounty notices.,I'm running out of places to put up the bounty notices.,gamedata/localizationstring_eng.paloc
contents_wanted_her_0010_npc_00_00011,contents,Contents,Scene Dialogue,Contents,Contents,0010,Contents 0010,contents_wanted_her_0010,wanted_her_0010,contents_wanted_her_0010_npc_00,wanted_her_0010_npc_00,wanted_her_0010,wanted,her_0010,11,npc_00,,npc_00,NPC 00,NPC 00,NPC,0,role,,"More outlaws by the day, yet no one ever gets caught.","More outlaws by the day, yet no one ever gets caught.",gamedata/localizationstring_eng.paloc
contents_wanted_her_0010_npc_00_00012,contents,Contents,Scene Dialogue,Contents,Contents,0010,Contents 0010,contents_wanted_her_0010,wanted_her_0010,contents_wanted_her_0010_npc_00,wanted_her_0010_npc_00,wanted_her_0010,wanted,her_0010,12,npc_00,,npc_00,NPC 00,NPC 00,NPC,0,role,,Interested? Take one.,Interested? Take one.,gamedata/localizationstring_eng.paloc
contents_wanted_her_0010_npc_00_00013,contents,Contents,Scene Dialogue,Contents,Contents,0010,Contents 0010,contents_wanted_her_0010,wanted_her_0010,contents_wanted_her_0010_npc_00,wanted_her_0010_npc_00,wanted_her_0010,wanted,her_0010,13,npc_00,,npc_00,NPC 00,NPC 00,NPC,0,role,,Drag any in and you'll be paid for your trouble.,Drag any in and you'll be paid for your trouble.,gamedata/localizationstring_eng.paloc
contents_wanted_her_0010_npc_00_00014,contents,Contents,Scene Dialogue,Contents,Contents,0010,Contents 0010,contents_wanted_her_0010,wanted_her_0010,contents_wanted_her_0010_npc_00,wanted_her_0010_npc_00,wanted_her_0010,wanted,her_0010,14,npc_00,,npc_00,NPC 00,NPC 00,NPC,0,role,,"Oh, it depends who you catch. Some fetch a fair bit, others only a few coins...","Oh, it depends who you catch. Some fetch a fair bit, others only a few coins...",gamedata/localizationstring_eng.paloc
contents_wanted_her_0010_npc_00_00015,contents,Contents,Scene Dialogue,Contents,Contents,0010,Contents 0010,contents_wanted_her_0010,wanted_her_0010,contents_wanted_her_0010_npc_00,wanted_her_0010_npc_00,wanted_her_0010,wanted,her_0010,15,npc_00,,npc_00,NPC 00,NPC 00,NPC,0,role,,but you'll get whatever amount what's written on the notice.,but you'll get whatever amount what's written on the notice.,gamedata/localizationstring_eng.paloc
contents_wanted_her_0010_npc_00_00016,contents,Contents,Scene Dialogue,Contents,Contents,0010,Contents 0010,contents_wanted_her_0010,wanted_her_0010,contents_wanted_her_0010_npc_00,wanted_her_0010_npc_00,wanted_her_0010,wanted,her_0010,16,npc_00,,npc_00,NPC 00,NPC 00,NPC,0,role,,"For what it's worth, you'll have my thanks, too, if you bring in the bastards.","For what it's worth, you'll have my thanks, too, if you bring in the bastards.",gamedata/localizationstring_eng.paloc
