key,family,family_display,category,subcategory,story_group,chapter_code,chapter_label,conversation_key,conversation_label,scene_key,scene_label,scene_group,scene_part_a,scene_part_b,line_index,dialogue_type,speaker_name,speaker_role,speaker_display,speaker_key,speaker_bucket,speaker_slot,speaker_confidence,mentions,text_raw,text_clean,source_path
lanford_bossencounter_stand_boss_00_00009,lanford,Lanford,Scene Dialogue,Lanford,Lanford,,Lanford,lanford_bossencounter_stand,bossencounter_stand,lanford_bossencounter_stand_boss_00,bossencounter_stand_boss_00,bossencounter_stand,bossencounter,stand,9,boss_00,,boss_00,Boss 00,Boss 00,Boss,0,role,,What's all this noise about?,What's all this noise about?,gamedata/localizationstring_eng.paloc
lanford_bossencounter_stand_boss_00_00010,lanford,Lanford,Scene Dialogue,Lanford,Lanford,,Lanford,lanford_bossencounter_stand,bossencounter_stand,lanford_bossencounter_stand_boss_00,bossencounter_stand_boss_00,bossencounter_stand,bossencounter,stand,10,boss_00,,boss_00,Boss 00,Boss 00,Boss,0,role,,"Here we go again, another tiresome nuisance...","Here we go again, another tiresome nuisance...",gamedata/localizationstring_eng.paloc
lanford_bossencounter_stand_boss_00_00011,lanford,Lanford,Scene Dialogue,Lanford,Lanford,,Lanford,lanford_bossencounter_stand,bossencounter_stand,lanford_bossencounter_stand_boss_00,bossencounter_stand_boss_00,bossencounter_stand,bossencounter,stand,11,boss_00,,boss_00,Boss 00,Boss 00,Boss,0,role,,I won't waste my time on the likes of you!,I won't waste my time on the likes of you!,gamedata/localizationstring_eng.paloc
lanford_bossencounter_stand_boss_00_00012,lanford,Lanford,Scene Dialogue,Lanford,Lanford,,Lanford,lanford_bossencounter_stand,bossencounter_stand,lanford_bossencounter_stand_boss_00,bossencounter_stand_boss_00,bossencounter_stand,bossencounter,stand,12,boss_00,,boss_00,Boss 00,Boss 00,Boss,0,role,,"For your sort, you held out well... now off you scurry!","For your sort, you held out well... now off you scurry!",gamedata/localizationstring_eng.paloc
lanford_bossencounter_stand_boss_00_00013,lanford,Lanford,Scene Dialogue,Lanford,Lanford,,Lanford,lanford_bossencounter_stand,bossencounter_stand,lanford_bossencounter_stand_boss_00,bossencounter_stand_boss_00,bossencounter_stand,bossencounter,stand,13,boss_00,,boss_00,Boss 00,Boss 00,Boss,0,role,,Why do I always end up in these ridiculous situations?,Why do I always end up in these ridiculous situations?,gamedata/localizationstring_eng.paloc
lanford_bossencounter_stand_boss_00_00014,lanford,Lanford,Scene Dialogue,Lanford,Lanford,,Lanford,lanford_bossencounter_stand,bossencounter_stand,lanford_bossencounter_stand_boss_00,bossencounter_stand_boss_00,bossencounter_stand,bossencounter,stand,14,boss_00,,boss_00,Boss 00,Boss 00,Boss,0,role,,Will you stop being such a constant irritation?,Will you stop being such a constant irritation?,gamedata/localizationstring_eng.paloc
lanford_bossencounter_stand_boss_00_00015,lanford,Lanford,Scene Dialogue,Lanford,Lanford,,Lanford,lanford_bossencounter_stand,bossencounter_stand,lanford_bossencounter_stand_boss_00,bossencounter_stand_boss_00,bossencounter_stand,bossencounter,stand,15,boss_00,,boss_00,Boss 00,Boss 00,Boss,0,role,,That's enough! My new clothes will be here any minute.,That's enough! My new clothes will be here any minute.,gamedata/localizationstring_eng.paloc
lanford_bossencounter_stand_boss_00_00016,lanford,Lanford,Scene Dialogue,Lanford,Lanford,,Lanford,lanford_bossencounter_stand,bossencounter_stand,lanford_bossencounter_stand_boss_00,bossencounter_stand_boss_00,bossencounter_stand,bossencounter,stand,16,boss_00,,boss_00,Boss 00,Boss 00,Boss,0,role,,Do you crave my company so badly?,Do you crave my company so badly?,gamedata/localizationstring_eng.paloc
