key,family,family_display,category,subcategory,story_group,chapter_code,chapter_label,conversation_key,conversation_label,scene_key,scene_label,scene_group,scene_part_a,scene_part_b,line_index,dialogue_type,speaker_name,speaker_role,speaker_display,speaker_key,speaker_bucket,speaker_slot,speaker_confidence,mentions,text_raw,text_clean,source_path
riventainmonastery_0700_npc_00_00002,riventainmonastery,Riventainmonastery,Scene Dialogue,Riventainmonastery,Riventainmonastery,0700,Riventainmonastery 0700,riventainmonastery_0700,0700,riventainmonastery_0700_npc_00,0700_npc_00,0700,0700,,2,npc_00,,npc_00,NPC 00,NPC 00,NPC,0,role,,I heard you caught Ulzok.,I heard you caught Ulzok.,gamedata/localizationstring_eng.paloc
riventainmonastery_0700_npc_00_00003,riventainmonastery,Riventainmonastery,Scene Dialogue,Riventainmonastery,Riventainmonastery,0700,Riventainmonastery 0700,riventainmonastery_0700,0700,riventainmonastery_0700_npc_00,0700_npc_00,0700,0700,,3,npc_00,,npc_00,NPC 00,NPC 00,NPC,0,role,,He grew up here at the monastery.,He grew up here at the monastery.,gamedata/localizationstring_eng.paloc
riventainmonastery_0700_npc_00_00004,riventainmonastery,Riventainmonastery,Scene Dialogue,Riventainmonastery,Riventainmonastery,0700,Riventainmonastery 0700,riventainmonastery_0700,0700,riventainmonastery_0700_npc_00,0700_npc_00,0700,0700,,4,npc_00,,npc_00,NPC 00,NPC 00,NPC,0,role,,"He left some time ago, haven't seen him since.","He left some time ago, haven't seen him since.",gamedata/localizationstring_eng.paloc
riventainmonastery_0700_npc_00_00005,riventainmonastery,Riventainmonastery,Scene Dialogue,Riventainmonastery,Riventainmonastery,0700,Riventainmonastery 0700,riventainmonastery_0700,0700,riventainmonastery_0700_npc_00,0700_npc_00,0700,0700,,5,npc_00,,npc_00,NPC 00,NPC 00,NPC,0,role,,He always had a knack for hiding in secret places...,He always had a knack for hiding in secret places...,gamedata/localizationstring_eng.paloc
riventainmonastery_0700_npc_00_00006,riventainmonastery,Riventainmonastery,Scene Dialogue,Riventainmonastery,Riventainmonastery,0700,Riventainmonastery 0700,riventainmonastery_0700,0700,riventainmonastery_0700_npc_00,0700_npc_00,0700,0700,,6,npc_00,,npc_00,NPC 00,NPC 00,NPC,0,role,,"And, funny thing, he loved to tell riddles.","And, funny thing, he loved to tell riddles.",gamedata/localizationstring_eng.paloc
riventainmonastery_0700_npc_00_00007,riventainmonastery,Riventainmonastery,Scene Dialogue,Riventainmonastery,Riventainmonastery,0700,Riventainmonastery 0700,riventainmonastery_0700,0700,riventainmonastery_0700_npc_00,0700_npc_00,0700,0700,,7,npc_00,,npc_00,NPC 00,NPC 00,NPC,0,role,,"He's quite a lonely fellow... had an unhealthy fixation on coin, too.","He's quite a lonely fellow... had an unhealthy fixation on coin, too.",gamedata/localizationstring_eng.paloc
riventainmonastery_0700_npc_00_00008,riventainmonastery,Riventainmonastery,Scene Dialogue,Riventainmonastery,Riventainmonastery,0700,Riventainmonastery 0700,riventainmonastery_0700,0700,riventainmonastery_0700_npc_00,0700_npc_00,0700,0700,,8,npc_00,,npc_00,NPC 00,NPC 00,NPC,0,role,,"Funny you should ask, I found one of his hand-drawn maps just yesterday.","Funny you should ask, I found one of his hand-drawn maps just yesterday.",gamedata/localizationstring_eng.paloc
riventainmonastery_0700_npc_00_00009,riventainmonastery,Riventainmonastery,Scene Dialogue,Riventainmonastery,Riventainmonastery,0700,Riventainmonastery 0700,riventainmonastery_0700,0700,riventainmonastery_0700_npc_00,0700_npc_00,0700,0700,,9,npc_00,,npc_00,NPC 00,NPC 00,NPC,0,role,,There's even one of his riddles along with it.,There's even one of his riddles along with it.,gamedata/localizationstring_eng.paloc
riventainmonastery_0700_npc_00_00010,riventainmonastery,Riventainmonastery,Scene Dialogue,Riventainmonastery,Riventainmonastery,0700,Riventainmonastery 0700,riventainmonastery_0700,0700,riventainmonastery_0700_npc_00,0700_npc_00,0700,0700,,10,npc_00,,npc_00,NPC 00,NPC 00,NPC,0,role,,"Here, how about you try to solve it?","Here, how about you try to solve it?",gamedata/localizationstring_eng.paloc
